root@lamp-ubuntu-s-1vcpu-1gb-tor1-01:~# tcpdump -r 0001.pcap
reading from file 0001.pcap, link-type EN10MB (Ethernet)
16:23:17.632566 IP lamp-ubuntu-s-1vcpu-1gb-tor1-01.ssh > cpe7c9a54544c2a-cm7c9a54544c28.cpe.net.cable.rogers.com.56834: Flags [P.], seq 2313926462:2313926506, ack 4291077999, win 501, length 44
16:23:17.632700 IP lamp-ubuntu-s-1vcpu-1gb-tor1-01.ssh > cpe7c9a54544c2a-cm7c9a54544c28.cpe.net.cable.rogers.com.56834: Flags [P.], seq 44:152, ack 1, win 501, length 108
16:23:17.632790 IP lamp-ubuntu-s-1vcpu-1gb-tor1-01.ssh > cpe7c9a54544c2a-cm7c9a54544c28.cpe.net.cable.rogers.com.56834: Flags [P.], seq 152:188, ack 1, win 501, length 36
16:23:17.646099 IP cpe7c9a54544c2a-cm7c9a54544c28.cpe.net.cable.rogers.com.56834 > lamp-ubuntu-s-1vcpu-1gb-tor1-01.ssh: Flags [.], ack 188, win 8269, length 0
root@lamp-ubuntu-s-1vcpu-1gb-tor1-01:~#