root@lamp-ubuntu-s-1vcpu-1gb-tor1-01:~# tcpdump -i eth0
tcpdump: verbose output suppressed, use -v or -vv for full protocol decode
listening on eth0, link-type EN10MB (Ethernet), capture size 262144 bytes
16:14:36.178840 IP lamp-ubuntu-s-1vcpu-1gb-tor1-01.ssh > cpe7c9a54544c2a-cm7c9a54544c28.cpe.net.cable.rogers.com.56834: Flags [P.], seq 2303365658:2303365766, ack 4291065919, win 501, length 108
16:14:36.178980 IP lamp-ubuntu-s-1vcpu-1gb-tor1-01.ssh > cpe7c9a54544c2a-cm7c9a54544c28.cpe.net.cable.rogers.com.56834: Flags [P.], seq 108:144, ack 1, win 501, length 36
16:14:36.179083 IP lamp-ubuntu-s-1vcpu-1gb-tor1-01.ssh > cpe7c9a54544c2a-cm7c9a54544c28.cpe.net.cable.rogers.com.56834: Flags [P.], seq 144:252, ack 1, win 501, length 108
16:14:36.179169 IP lamp-ubuntu-s-1vcpu-1gb-tor1-01.ssh > cpe7c9a54544c2a-cm7c9a54544c28.cpe.net.cable.rogers.com.56834: Flags [P.], seq 252:288, ack 1, win 501, length 36
16:14:36.180572 IP lamp-ubuntu-s-1vcpu-1gb-tor1-01.34508 > 67.207.67.2.domain: 13164+ [1au] PTR? 234.128.248.99.in-addr.arpa. (56)
16:14:36.180790 IP lamp-ubuntu-s-1vcpu-1gb-tor1-01.52888 > 67.207.67.3.domain: 40291+ [1au] PTR? 234.128.248.99.in-addr.arpa. (56)
16:14:36.181581 IP lamp-ubuntu-s-1vcpu-1gb-tor1-01.43445 > 67.207.67.2.domain: 60615+ [1au] PTR? 176.158.182.147.in-addr.arpa. (57)
16:14:36.181722 IP lamp-ubuntu-s-1vcpu-1gb-tor1-01.48181 > 67.207.67.3.domain: 58651+ [1au] PTR? 176.158.182.147.in-addr.arpa. (57)
16:14:36.181841 IP lamp-ubuntu-s-1vcpu-1gb-tor1-01.33044 > 67.207.67.3.domain: 22924+ [1au] PTR? 176.158.182.147.in-addr.arpa. (57)
16:14:36.182384 IP 67.207.67.2.domain > lamp-ubuntu-s-1vcpu-1gb-tor1-01.34508: 13164 1/0/1 PTR cpe7c9a54544c2a-cm7c9a54544c28.cpe.net.cable.rogers.com. (125)
16:14:36.182384 IP 67.207.67.2.domain > lamp-ubuntu-s-1vcpu-1gb-tor1-01.43445: 60615 NXDomain 0/1/1 (124)
16:14:36.182437 IP lamp-ubuntu-s-1vcpu-1gb-tor1-01 > 67.207.67.2: ICMP lamp-ubuntu-s-1vcpu-1gb-tor1-01 udp port 34508 unreachable, length 161
16:14:36.182488 IP 67.207.67.3.domain > lamp-ubuntu-s-1vcpu-1gb-tor1-01.48181: 58651 NXDomain 0/1/1 (124)
16:14:36.182671 IP 67.207.67.3.domain > lamp-ubuntu-s-1vcpu-1gb-tor1-01.33044: 22924 NXDomain 0/1/1 (124)
16:14:36.182797 IP lamp-ubuntu-s-1vcpu-1gb-tor1-01.43445 > 67.207.67.2.domain: 60615+ PTR? 176.158.182.147.in-addr.arpa. (46)
16:14:36.182987 IP lamp-ubuntu-s-1vcpu-1gb-tor1-01.48181 > 67.207.67.3.domain: 58651+ PTR? 176.158.182.147.in-addr.arpa. (46)
16:14:36.183121 IP lamp-ubuntu-s-1vcpu-1gb-tor1-01.33044 > 67.207.67.3.domain: 22924+ PTR? 176.158.182.147.in-addr.arpa. (46)
16:14:36.183266 IP 67.207.67.2.domain > lamp-ubuntu-s-1vcpu-1gb-tor1-01.43445: 60615 NXDomain 0/1/0 (113)
16:14:36.183391 IP 67.207.67.3.domain > lamp-ubuntu-s-1vcpu-1gb-tor1-01.48181: 58651 NXDomain 0/1/0 (113)
16:14:36.183528 IP 67.207.67.3.domain > lamp-ubuntu-s-1vcpu-1gb-tor1-01.33044: 22924 NXDomain 0/1/0 (113)
16:14:36.184251 IP lamp-ubuntu-s-1vcpu-1gb-tor1-01.ssh > cpe7c9a54544c2a-cm7c9a54544c28.cpe.net.cable.rogers.com.56834: Flags [P.], seq 288:516, ack 1, win 501, length 228
16:14:36.184364 IP lamp-ubuntu-s-1vcpu-1gb-tor1-01.ssh > cpe7c9a54544c2a-cm7c9a54544c28.cpe.net.cable.rogers.com.56834: Flags [P.], seq 516:552, ack 1, win 501, length 36
16:14:36.184488 IP lamp-ubuntu-s-1vcpu-1gb-tor1-01.ssh > cpe7c9a54544c2a-cm7c9a54544c28.cpe.net.cable.rogers.com.56834: Flags [P.], seq 552:756, ack 1, win 501, length 204
16:14:36.184579 IP lamp-ubuntu-s-1vcpu-1gb-tor1-01.ssh > cpe7c9a54544c2a-cm7c9a54544c28.cpe.net.cable.rogers.com.56834: Flags [P.], seq 756:792, ack 1, win 501, length 36
16:14:36.184712 IP lamp-ubuntu-s-1vcpu-1gb-tor1-01.ssh > cpe7c9a54544c2a-cm7c9a54544c28.cpe.net.cable.rogers.com.56834: Flags [P.], seq 792:1004, ack 1, win 501, length 212
16:14:36.185360 IP lamp-ubuntu-s-1vcpu-1gb-tor1-01.33545 > 67.207.67.2.domain: 37148+ [1au] PTR? 2.67.207.67.in-addr.arpa. (53)
16:14:36.185515 IP lamp-ubuntu-s-1vcpu-1gb-tor1-01.60927 > 67.207.67.3.domain: 9550+ [1au] PTR? 2.67.207.67.in-addr.arpa. (53)
16:14:36.185638 IP lamp-ubuntu-s-1vcpu-1gb-tor1-01.56347 > 67.207.67.3.domain: 10912+ [1au] PTR? 2.67.207.67.in-addr.arpa. (53)
16:14:36.185759 IP 67.207.67.2.domain > lamp-ubuntu-s-1vcpu-1gb-tor1-01.33545: 37148 NXDomain 0/1/1 (120)
16:14:36.185903 IP 67.207.67.3.domain > lamp-ubuntu-s-1vcpu-1gb-tor1-01.60927: 9550 NXDomain 0/1/1 (120)
16:14:36.186015 IP 67.207.67.3.domain > lamp-ubuntu-s-1vcpu-1gb-tor1-01.56347: 10912 NXDomain 0/1/1 (120)
16:14:36.186054 IP lamp-ubuntu-s-1vcpu-1gb-tor1-01.33545 > 67.207.67.2.domain: 37148+ PTR? 2.67.207.67.in-addr.arpa. (42)
16:14:36.186169 IP lamp-ubuntu-s-1vcpu-1gb-tor1-01.60927 > 67.207.67.3.domain: 9550+ PTR? 2.67.207.67.in-addr.arpa. (42)
16:14:36.186264 IP lamp-ubuntu-s-1vcpu-1gb-tor1-01.56347 > 67.207.67.3.domain: 10912+ PTR? 2.67.207.67.in-addr.arpa. (42)
16:14:36.186394 IP 67.207.67.2.domain > lamp-ubuntu-s-1vcpu-1gb-tor1-01.33545: 37148 NXDomain 0/1/0 (109)
16:14:36.186463 IP 67.207.67.3.domain > lamp-ubuntu-s-1vcpu-1gb-tor1-01.60927: 9550 NXDomain 0/1/0 (109)
16:14:36.187801 IP lamp-ubuntu-s-1vcpu-1gb-tor1-01.51711 > 67.207.67.2.domain: 35739+ [1au] PTR? 3.67.207.67.in-addr.arpa. (53)
16:14:36.191531 IP cpe7c9a54544c2a-cm7c9a54544c28.cpe.net.cable.rogers.com.56834 > lamp-ubuntu-s-1vcpu-1gb-tor1-01.ssh: Flags [.], ack 288, win 255, length 0
16:14:36.191575 IP lamp-ubuntu-s-1vcpu-1gb-tor1-01.ssh > cpe7c9a54544c2a-cm7c9a54544c28.cpe.net.cable.rogers.com.56834: Flags [P.], seq 1004:3924, ack 1, win 501, length 2920
16:14:36.191600 IP lamp-ubuntu-s-1vcpu-1gb-tor1-01.ssh > cpe7c9a54544c2a-cm7c9a54544c28.cpe.net.cable.rogers.com.56834: Flags [P.], seq 3924:5596, ack 1, win 501, length 1672
16:14:36.191724 IP lamp-ubuntu-s-1vcpu-1gb-tor1-01.ssh > cpe7c9a54544c2a-cm7c9a54544c28.cpe.net.cable.rogers.com.56834: Flags [P.], seq 5596:5632, ack 1, win 501, length 36
16:14:36.191949 IP lamp-ubuntu-s-1vcpu-1gb-tor1-01.ssh > cpe7c9a54544c2a-cm7c9a54544c28.cpe.net.cable.rogers.com.56834: Flags [P.], seq 5632:5796, ack 1, win 501, length 164
16:14:36.192084 IP lamp-ubuntu-s-1vcpu-1gb-tor1-01.ssh > cpe7c9a54544c2a-cm7c9a54544c28.cpe.net.cable.rogers.com.56834: Flags [P.], seq 5796:5832, ack 1, win 501, length 36
16:14:36.192227 IP lamp-ubuntu-s-1vcpu-1gb-tor1-01.ssh > cpe7c9a54544c2a-cm7c9a54544c28.cpe.net.cable.rogers.com.56834: Flags [P.], seq 5832:5996, ack 1, win 501, length 164
16:14:36.192310 IP lamp-ubuntu-s-1vcpu-1gb-tor1-01.ssh > cpe7c9a54544c2a-cm7c9a54544c28.cpe.net.cable.rogers.com.56834: Flags [P.], seq 5996:6032, ack 1, win 501, length 36
16:14:36.192428 IP lamp-ubuntu-s-1vcpu-1gb-tor1-01.ssh > cpe7c9a54544c2a-cm7c9a54544c28.cpe.net.cable.rogers.com.56834: Flags [P.], seq 6032:6196, ack 1, win 501, length 164
16:14:36.192583 IP 67.207.67.3.domain > lamp-ubuntu-s-1vcpu-1gb-tor1-01.52888: 40291 1/0/1 PTR cpe7c9a54544c2a-cm7c9a54544c28.cpe.net.cable.rogers.com. (125)
16:14:36.192613 IP lamp-ubuntu-s-1vcpu-1gb-tor1-01 > 67.207.67.3: ICMP lamp-ubuntu-s-1vcpu-1gb-tor1-01 udp port 52888 unreachable, length 161
16:14:36.199698 IP cpe7c9a54544c2a-cm7c9a54544c28.cpe.net.cable.rogers.com.56834 > lamp-ubuntu-s-1vcpu-1gb-tor1-01.ssh: Flags [.], ack 1004, win 252, length 0
16:14:36.199762 IP lamp-ubuntu-s-1vcpu-1gb-tor1-01.ssh > cpe7c9a54544c2a-cm7c9a54544c28.cpe.net.cable.rogers.com.56834: Flags [P.], seq 6196:9116, ack 1, win 501, length 2920
16:14:36.199792 IP lamp-ubuntu-s-1vcpu-1gb-tor1-01.ssh > cpe7c9a54544c2a-cm7c9a54544c28.cpe.net.cable.rogers.com.56834: Flags [P.], seq 9116:10552, ack 1, win 501, length 1436
16:14:36.199973 IP lamp-ubuntu-s-1vcpu-1gb-tor1-01.ssh > cpe7c9a54544c2a-cm7c9a54544c28.cpe.net.cable.rogers.com.56834: Flags [P.], seq 10552:10748, ack 1, win 501, length 196
16:14:36.200081 IP lamp-ubuntu-s-1vcpu-1gb-tor1-01.ssh > cpe7c9a54544c2a-cm7c9a54544c28.cpe.net.cable.rogers.com.56834: Flags [P.], seq 10748:10784, ack 1, win 501, length 36
16:14:36.200250 IP lamp-ubuntu-s-1vcpu-1gb-tor1-01.ssh > cpe7c9a54544c2a-cm7c9a54544c28.cpe.net.cable.rogers.com.56834: Flags [P.], seq 10784:10996, ack 1, win 501, length 212
16:14:36.200376 IP lamp-ubuntu-s-1vcpu-1gb-tor1-01.ssh > cpe7c9a54544c2a-cm7c9a54544c28.cpe.net.cable.rogers.com.56834: Flags [P.], seq 10996:11032, ack 1, win 501, length 36
16:14:36.200533 IP lamp-ubuntu-s-1vcpu-1gb-tor1-01.ssh > cpe7c9a54544c2a-cm7c9a54544c28.cpe.net.cable.rogers.com.56834: Flags [P.], seq 11032:11244, ack 1, win 501, length 212
16:14:36.200627 IP lamp-ubuntu-s-1vcpu-1gb-tor1-01.ssh > cpe7c9a54544c2a-cm7c9a54544c28.cpe.net.cable.rogers.com.56834: Flags [P.], seq 11244:11280, ack 1, win 501, length 36
16:14:36.200741 IP lamp-ubuntu-s-1vcpu-1gb-tor1-01.ssh > cpe7c9a54544c2a-cm7c9a54544c28.cpe.net.cable.rogers.com.56834: Flags [P.], seq 11280:11492, ack 1, win 501, length 212
16:14:36.212189 IP cpe7c9a54544c2a-cm7c9a54544c28.cpe.net.cable.rogers.com.56834 > lamp-ubuntu-s-1vcpu-1gb-tor1-01.ssh: Flags [.], ack 6196, win 256, length 0
16:14:36.212253 IP lamp-ubuntu-s-1vcpu-1gb-tor1-01.ssh > cpe7c9a54544c2a-cm7c9a54544c28.cpe.net.cable.rogers.com.56834: Flags [P.], seq 11492:13016, ack 1, win 501, length 1524
16:14:36.212474 IP lamp-ubuntu-s-1vcpu-1gb-tor1-01.ssh > cpe7c9a54544c2a-cm7c9a54544c28.cpe.net.cable.rogers.com.56834: Flags [P.], seq 13016:13212, ack 1, win 501, length 196
16:14:36.212606 IP lamp-ubuntu-s-1vcpu-1gb-tor1-01.ssh > cpe7c9a54544c2a-cm7c9a54544c28.cpe.net.cable.rogers.com.56834: Flags [P.], seq 13212:13248, ack 1, win 501, length 36
16:14:36.212770 IP lamp-ubuntu-s-1vcpu-1gb-tor1-01.ssh > cpe7c9a54544c2a-cm7c9a54544c28.cpe.net.cable.rogers.com.56834: Flags [P.], seq 13248:13460, ack 1, win 501, length 212
16:14:36.212880 IP lamp-ubuntu-s-1vcpu-1gb-tor1-01.ssh > cpe7c9a54544c2a-cm7c9a54544c28.cpe.net.cable.rogers.com.56834: Flags [P.], seq 13460:13496, ack 1, win 501, length 36
16:14:36.213017 IP lamp-ubuntu-s-1vcpu-1gb-tor1-01.ssh > cpe7c9a54544c2a-cm7c9a54544c28.cpe.net.cable.rogers.com.56834: Flags [P.], seq 13496:13708, ack 1, win 501, length 212
16:14:36.213131 IP lamp-ubuntu-s-1vcpu-1gb-tor1-01.ssh > cpe7c9a54544c2a-cm7c9a54544c28.cpe.net.cable.rogers.com.56834: Flags [P.], seq 13708:13744, ack 1, win 501, length 36
16:14:36.213251 IP lamp-ubuntu-s-1vcpu-1gb-tor1-01.ssh > cpe7c9a54544c2a-cm7c9a54544c28.cpe.net.cable.rogers.com.56834: Flags [P.], seq 13744:13956, ack 1, win 501, length 212
16:14:36.213335 IP lamp-ubuntu-s-1vcpu-1gb-tor1-01.ssh > cpe7c9a54544c2a-cm7c9a54544c28.cpe.net.cable.rogers.com.56834: Flags [P.], seq 13956:13992, ack 1, win 501, length 36
16:14:36.213468 IP lamp-ubuntu-s-1vcpu-1gb-tor1-01.ssh > cpe7c9a54544c2a-cm7c9a54544c28.cpe.net.cable.rogers.com.56834: Flags [P.], seq 13992:14204, ack 1, win 501, length 212
16:14:36.213536 IP lamp-ubuntu-s-1vcpu-1gb-tor1-01.ssh > cpe7c9a54544c2a-cm7c9a54544c28.cpe.net.cable.rogers.com.56834: Flags [P.], seq 14204:14240, ack 1, win 501, length 36
16:14:36.213622 IP lamp-ubuntu-s-1vcpu-1gb-tor1-01.ssh > cpe7c9a54544c2a-cm7c9a54544c28.cpe.net.cable.rogers.com.56834: Flags [P.], seq 14240:14452, ack 1, win 501, length 212
16:14:36.213689 IP lamp-ubuntu-s-1vcpu-1gb-tor1-01.ssh > cpe7c9a54544c2a-cm7c9a54544c28.cpe.net.cable.rogers.com.56834: Flags [P.], seq 14452:14488, ack 1, win 501, length 36
16:14:36.213766 IP lamp-ubuntu-s-1vcpu-1gb-tor1-01.ssh > cpe7c9a54544c2a-cm7c9a54544c28.cpe.net.cable.rogers.com.56834: Flags [P.], seq 14488:14700, ack 1, win 501, length 212
16:14:36.213826 IP lamp-ubuntu-s-1vcpu-1gb-tor1-01.ssh > cpe7c9a54544c2a-cm7c9a54544c28.cpe.net.cable.rogers.com.56834: Flags [P.], seq 14700:14736, ack 1, win 501, length 36
16:14:36.213901 IP lamp-ubuntu-s-1vcpu-1gb-tor1-01.ssh > cpe7c9a54544c2a-cm7c9a54544c28.cpe.net.cable.rogers.com.56834: Flags [P.], seq 14736:14948, ack 1, win 501, length 212
16:14:36.213958 IP lamp-ubuntu-s-1vcpu-1gb-tor1-01.ssh > cpe7c9a54544c2a-cm7c9a54544c28.cpe.net.cable.rogers.com.56834: Flags [P.], seq 14948:14984, ack 1, win 501, length 36
16:14:36.214034 IP lamp-ubuntu-s-1vcpu-1gb-tor1-01.ssh > cpe7c9a54544c2a-cm7c9a54544c28.cpe.net.cable.rogers.com.56834: Flags [P.], seq 14984:15196, ack 1, win 501, length 212
16:14:36.214091 IP lamp-ubuntu-s-1vcpu-1gb-tor1-01.ssh > cpe7c9a54544c2a-cm7c9a54544c28.cpe.net.cable.rogers.com.56834: Flags [P.], seq 15196:15232, ack 1, win 501, length 36
16:14:36.218162 IP cpe7c9a54544c2a-cm7c9a54544c28.cpe.net.cable.rogers.com.56834 > lamp-ubuntu-s-1vcpu-1gb-tor1-01.ssh: Flags [.], ack 11492, win 256, length 0
16:14:36.218221 IP lamp-ubuntu-s-1vcpu-1gb-tor1-01.ssh > cpe7c9a54544c2a-cm7c9a54544c28.cpe.net.cable.rogers.com.56834: Flags [P.], seq 15232:17636, ack 1, win 501, length 2404
16:14:36.218529 IP lamp-ubuntu-s-1vcpu-1gb-tor1-01.ssh > cpe7c9a54544c2a-cm7c9a54544c28.cpe.net.cable.rogers.com.56834: Flags [P.], seq 17636:18080, ack 1, win 501, length 444
16:14:36.218674 IP lamp-ubuntu-s-1vcpu-1gb-tor1-01.ssh > cpe7c9a54544c2a-cm7c9a54544c28.cpe.net.cable.rogers.com.56834: Flags [P.], seq 18080:18292, ack 1, win 501, length 212
16:14:36.218842 IP lamp-ubuntu-s-1vcpu-1gb-tor1-01.ssh > cpe7c9a54544c2a-cm7c9a54544c28.cpe.net.cable.rogers.com.56834: Flags [P.], seq 18292:18512, ack 1, win 501, length 220
16:14:36.219000 IP lamp-ubuntu-s-1vcpu-1gb-tor1-01.ssh > cpe7c9a54544c2a-cm7c9a54544c28.cpe.net.cable.rogers.com.56834: Flags [P.], seq 18512:18724, ack 1, win 501, length 212
16:14:36.219154 IP lamp-ubuntu-s-1vcpu-1gb-tor1-01.ssh > cpe7c9a54544c2a-cm7c9a54544c28.cpe.net.cable.rogers.com.56834: Flags [P.], seq 18724:18936, ack 1, win 501, length 212
16:14:36.219306 IP lamp-ubuntu-s-1vcpu-1gb-tor1-01.ssh > cpe7c9a54544c2a-cm7c9a54544c28.cpe.net.cable.rogers.com.56834: Flags [P.], seq 18936:19148, ack 1, win 501, length 212
16:14:36.219487 IP lamp-ubuntu-s-1vcpu-1gb-tor1-01.ssh > cpe7c9a54544c2a-cm7c9a54544c28.cpe.net.cable.rogers.com.56834: Flags [P.], seq 19148:19360, ack 1, win 501, length 212
16:14:36.219646 IP lamp-ubuntu-s-1vcpu-1gb-tor1-01.ssh > cpe7c9a54544c2a-cm7c9a54544c28.cpe.net.cable.rogers.com.56834: Flags [P.], seq 19360:19572, ack 1, win 501, length 212
16:14:36.219803 IP lamp-ubuntu-s-1vcpu-1gb-tor1-01.ssh > cpe7c9a54544c2a-cm7c9a54544c28.cpe.net.cable.rogers.com.56834: Flags [P.], seq 19572:19784, ack 1, win 501, length 212
16:14:36.219980 IP lamp-ubuntu-s-1vcpu-1gb-tor1-01.ssh > cpe7c9a54544c2a-cm7c9a54544c28.cpe.net.cable.rogers.com.56834: Flags [P.], seq 19784:19996, ack 1, win 501, length 212
16:14:36.220137 IP lamp-ubuntu-s-1vcpu-1gb-tor1-01.ssh > cpe7c9a54544c2a-cm7c9a54544c28.cpe.net.cable.rogers.com.56834: Flags [P.], seq 19996:20208, ack 1, win 501, length 212
16:14:36.220289 IP lamp-ubuntu-s-1vcpu-1gb-tor1-01.ssh > cpe7c9a54544c2a-cm7c9a54544c28.cpe.net.cable.rogers.com.56834: Flags [P.], seq 20208:20420, ack 1, win 501, length 212
16:14:36.220415 IP lamp-ubuntu-s-1vcpu-1gb-tor1-01.ssh > cpe7c9a54544c2a-cm7c9a54544c28.cpe.net.cable.rogers.com.56834: Flags [P.], seq 20420:20632, ack 1, win 501, length 212
16:14:36.220517 IP lamp-ubuntu-s-1vcpu-1gb-tor1-01.ssh > cpe7c9a54544c2a-cm7c9a54544c28.cpe.net.cable.rogers.com.56834: Flags [P.], seq 20632:20844, ack 1, win 501, length 212
16:14:36.220620 IP lamp-ubuntu-s-1vcpu-1gb-tor1-01.ssh > cpe7c9a54544c2a-cm7c9a54544c28.cpe.net.cable.rogers.com.56834: Flags [P.], seq 20844:21056, ack 1, win 501, length 212
16:14:36.220715 IP lamp-ubuntu-s-1vcpu-1gb-tor1-01.ssh > cpe7c9a54544c2a-cm7c9a54544c28.cpe.net.cable.rogers.com.56834: Flags [P.], seq 21056:21268, ack 1, win 501, length 212
16:14:36.220802 IP lamp-ubuntu-s-1vcpu-1gb-tor1-01.ssh > cpe7c9a54544c2a-cm7c9a54544c28.cpe.net.cable.rogers.com.56834: Flags [P.], seq 21268:21480, ack 1, win 501, length 212
16:14:36.220890 IP lamp-ubuntu-s-1vcpu-1gb-tor1-01.ssh > cpe7c9a54544c2a-cm7c9a54544c28.cpe.net.cable.rogers.com.56834: Flags [P.], seq 21480:21692, ack 1, win 501, length 212
16:14:36.231665 IP cpe7c9a54544c2a-cm7c9a54544c28.cpe.net.cable.rogers.com.56834 > lamp-ubuntu-s-1vcpu-1gb-tor1-01.ssh: Flags [.], ack 21692, win 256, length 0
16:14:36.231779 IP lamp-ubuntu-s-1vcpu-1gb-tor1-01.ssh > cpe7c9a54544c2a-cm7c9a54544c28.cpe.net.cable.rogers.com.56834: Flags [P.], seq 21692:21904, ack 1, win 501, length 212
16:14:36.232048 IP lamp-ubuntu-s-1vcpu-1gb-tor1-01.ssh > cpe7c9a54544c2a-cm7c9a54544c28.cpe.net.cable.rogers.com.56834: Flags [P.], seq 21904:22276, ack 1, win 501, length 372
16:14:36.232279 IP lamp-ubuntu-s-1vcpu-1gb-tor1-01.ssh > cpe7c9a54544c2a-cm7c9a54544c28.cpe.net.cable.rogers.com.56834: Flags [P.], seq 22276:22488, ack 1, win 501, length 212
16:14:36.232474 IP lamp-ubuntu-s-1vcpu-1gb-tor1-01.ssh > cpe7c9a54544c2a-cm7c9a54544c28.cpe.net.cable.rogers.com.56834: Flags [P.], seq 22488:22700, ack 1, win 501, length 212
16:14:36.232716 IP lamp-ubuntu-s-1vcpu-1gb-tor1-01.ssh > cpe7c9a54544c2a-cm7c9a54544c28.cpe.net.cable.rogers.com.56834: Flags [P.], seq 22700:22912, ack 1, win 501, length 212
16:14:36.232862 IP lamp-ubuntu-s-1vcpu-1gb-tor1-01.ssh > cpe7c9a54544c2a-cm7c9a54544c28.cpe.net.cable.rogers.com.56834: Flags [P.], seq 22912:23124, ack 1, win 501, length 212
16:14:36.232993 IP lamp-ubuntu-s-1vcpu-1gb-tor1-01.ssh > cpe7c9a54544c2a-cm7c9a54544c28.cpe.net.cable.rogers.com.56834: Flags [P.], seq 23124:23336, ack 1, win 501, length 212
16:14:36.233127 IP lamp-ubuntu-s-1vcpu-1gb-tor1-01.ssh > cpe7c9a54544c2a-cm7c9a54544c28.cpe.net.cable.rogers.com.56834: Flags [P.], seq 23336:23548, ack 1, win 501, length 212
16:14:36.233325 IP lamp-ubuntu-s-1vcpu-1gb-tor1-01.ssh > cpe7c9a54544c2a-cm7c9a54544c28.cpe.net.cable.rogers.com.56834: Flags [P.], seq 23548:23760, ack 1, win 501, length 212
16:14:36.233475 IP lamp-ubuntu-s-1vcpu-1gb-tor1-01.ssh > cpe7c9a54544c2a-cm7c9a54544c28.cpe.net.cable.rogers.com.56834: Flags [P.], seq 23760:23972, ack 1, win 501, length 212
16:14:36.233608 IP lamp-ubuntu-s-1vcpu-1gb-tor1-01.ssh > cpe7c9a54544c2a-cm7c9a54544c28.cpe.net.cable.rogers.com.56834: Flags [P.], seq 23972:24184, ack 1, win 501, length 212
16:14:36.233817 IP lamp-ubuntu-s-1vcpu-1gb-tor1-01.ssh > cpe7c9a54544c2a-cm7c9a54544c28.cpe.net.cable.rogers.com.56834: Flags [P.], seq 24184:24396, ack 1, win 501, length 212
16:14:36.233992 IP lamp-ubuntu-s-1vcpu-1gb-tor1-01.ssh > cpe7c9a54544c2a-cm7c9a54544c28.cpe.net.cable.rogers.com.56834: Flags [P.], seq 24396:24608, ack 1, win 501, length 212
16:14:36.234116 IP lamp-ubuntu-s-1vcpu-1gb-tor1-01.ssh > cpe7c9a54544c2a-cm7c9a54544c28.cpe.net.cable.rogers.com.56834: Flags [P.], seq 24608:24820, ack 1, win 501, length 212
16:14:36.234241 IP lamp-ubuntu-s-1vcpu-1gb-tor1-01.ssh > cpe7c9a54544c2a-cm7c9a54544c28.cpe.net.cable.rogers.com.56834: Flags [P.], seq 24820:25032, ack 1, win 501, length 212
16:14:36.234370 IP lamp-ubuntu-s-1vcpu-1gb-tor1-01.ssh > cpe7c9a54544c2a-cm7c9a54544c28.cpe.net.cable.rogers.com.56834: Flags [P.], seq 25032:25244, ack 1, win 501, length 212
16:14:36.234498 IP lamp-ubuntu-s-1vcpu-1gb-tor1-01.ssh > cpe7c9a54544c2a-cm7c9a54544c28.cpe.net.cable.rogers.com.56834: Flags [P.], seq 25244:25456, ack 1, win 501, length 212
16:14:36.234663 IP lamp-ubuntu-s-1vcpu-1gb-tor1-01.ssh > cpe7c9a54544c2a-cm7c9a54544c28.cpe.net.cable.rogers.com.56834: Flags [P.], seq 25456:25668, ack 1, win 501, length 212
16:14:36.234790 IP lamp-ubuntu-s-1vcpu-1gb-tor1-01.ssh > cpe7c9a54544c2a-cm7c9a54544c28.cpe.net.cable.rogers.com.56834: Flags [P.], seq 25668:25880, ack 1, win 501, length 212
16:14:36.234956 IP lamp-ubuntu-s-1vcpu-1gb-tor1-01.ssh > cpe7c9a54544c2a-cm7c9a54544c28.cpe.net.cable.rogers.com.56834: Flags [P.], seq 25880:26092, ack 1, win 501, length 212
16:14:36.235145 IP lamp-ubuntu-s-1vcpu-1gb-tor1-01.ssh > cpe7c9a54544c2a-cm7c9a54544c28.cpe.net.cable.rogers.com.56834: Flags [P.], seq 26092:26304, ack 1, win 501, length 212
16:14:36.235299 IP lamp-ubuntu-s-1vcpu-1gb-tor1-01.ssh > cpe7c9a54544c2a-cm7c9a54544c28.cpe.net.cable.rogers.com.56834: Flags [P.], seq 26304:26516, ack 1, win 501, length 212
16:14:36.235508 IP lamp-ubuntu-s-1vcpu-1gb-tor1-01.ssh > cpe7c9a54544c2a-cm7c9a54544c28.cpe.net.cable.rogers.com.56834: Flags [P.], seq 26516:26728, ack 1, win 501, length 212
16:14:36.235682 IP lamp-ubuntu-s-1vcpu-1gb-tor1-01.ssh > cpe7c9a54544c2a-cm7c9a54544c28.cpe.net.cable.rogers.com.56834: Flags [P.], seq 26728:26940, ack 1, win 501, length 212
16:14:36.235865 IP lamp-ubuntu-s-1vcpu-1gb-tor1-01.ssh > cpe7c9a54544c2a-cm7c9a54544c28.cpe.net.cable.rogers.com.56834: Flags [P.], seq 26940:27152, ack 1, win 501, length 212
16:14:36.235996 IP lamp-ubuntu-s-1vcpu-1gb-tor1-01.ssh > cpe7c9a54544c2a-cm7c9a54544c28.cpe.net.cable.rogers.com.56834: Flags [P.], seq 27152:27364, ack 1, win 501, length 212
16:14:36.236175 IP lamp-ubuntu-s-1vcpu-1gb-tor1-01.ssh > cpe7c9a54544c2a-cm7c9a54544c28.cpe.net.cable.rogers.com.56834: Flags [P.], seq 27364:27576, ack 1, win 501, length 212
16:14:36.236384 IP lamp-ubuntu-s-1vcpu-1gb-tor1-01.ssh > cpe7c9a54544c2a-cm7c9a54544c28.cpe.net.cable.rogers.com.56834: Flags [P.], seq 27576:27788, ack 1, win 501, length 212
16:14:36.236582 IP lamp-ubuntu-s-1vcpu-1gb-tor1-01.ssh > cpe7c9a54544c2a-cm7c9a54544c28.cpe.net.cable.rogers.com.56834: Flags [P.], seq 27788:28000, ack 1, win 501, length 212
16:14:36.236728 IP lamp-ubuntu-s-1vcpu-1gb-tor1-01.ssh > cpe7c9a54544c2a-cm7c9a54544c28.cpe.net.cable.rogers.com.56834: Flags [P.], seq 28000:28212, ack 1, win 501, length 212
16:14:36.236848 IP lamp-ubuntu-s-1vcpu-1gb-tor1-01.ssh > cpe7c9a54544c2a-cm7c9a54544c28.cpe.net.cable.rogers.com.56834: Flags [P.], seq 28212:28424, ack 1, win 501, length 212
16:14:36.236974 IP lamp-ubuntu-s-1vcpu-1gb-tor1-01.ssh > cpe7c9a54544c2a-cm7c9a54544c28.cpe.net.cable.rogers.com.56834: Flags [P.], seq 28424:28636, ack 1, win 501, length 212
16:14:36.237092 IP lamp-ubuntu-s-1vcpu-1gb-tor1-01.ssh > cpe7c9a54544c2a-cm7c9a54544c28.cpe.net.cable.rogers.com.56834: Flags [P.], seq 28636:28848, ack 1, win 501, length 212
16:14:36.237296 IP lamp-ubuntu-s-1vcpu-1gb-tor1-01.ssh > cpe7c9a54544c2a-cm7c9a54544c28.cpe.net.cable.rogers.com.56834: Flags [P.], seq 28848:29060, ack 1, win 501, length 212
16:14:36.237462 IP lamp-ubuntu-s-1vcpu-1gb-tor1-01.ssh > cpe7c9a54544c2a-cm7c9a54544c28.cpe.net.cable.rogers.com.56834: Flags [P.], seq 29060:29272, ack 1, win 501, length 212
16:14:36.237586 IP lamp-ubuntu-s-1vcpu-1gb-tor1-01.ssh > cpe7c9a54544c2a-cm7c9a54544c28.cpe.net.cable.rogers.com.56834: Flags [P.], seq 29272:29484, ack 1, win 501, length 212
16:14:36.237736 IP lamp-ubuntu-s-1vcpu-1gb-tor1-01.ssh > cpe7c9a54544c2a-cm7c9a54544c28.cpe.net.cable.rogers.com.56834: Flags [P.], seq 29484:29696, ack 1, win 501, length 212
16:14:36.237930 IP lamp-ubuntu-s-1vcpu-1gb-tor1-01.ssh > cpe7c9a54544c2a-cm7c9a54544c28.cpe.net.cable.rogers.com.56834: Flags [P.], seq 29696:29908, ack 1, win 501, length 212
16:14:36.238065 IP lamp-ubuntu-s-1vcpu-1gb-tor1-01.ssh > cpe7c9a54544c2a-cm7c9a54544c28.cpe.net.cable.rogers.com.56834: Flags [P.], seq 29908:30120, ack 1, win 501, length 212
16:14:36.238254 IP lamp-ubuntu-s-1vcpu-1gb-tor1-01.ssh > cpe7c9a54544c2a-cm7c9a54544c28.cpe.net.cable.rogers.com.56834: Flags [P.], seq 30120:30332, ack 1, win 501, length 212
16:14:36.238410 IP lamp-ubuntu-s-1vcpu-1gb-tor1-01.ssh > cpe7c9a54544c2a-cm7c9a54544c28.cpe.net.cable.rogers.com.56834: Flags [P.], seq 30332:30544, ack 1, win 501, length 212
16:14:36.238537 IP lamp-ubuntu-s-1vcpu-1gb-tor1-01.ssh > cpe7c9a54544c2a-cm7c9a54544c28.cpe.net.cable.rogers.com.56834: Flags [P.], seq 30544:30756, ack 1, win 501, length 212
16:14:36.238691 IP lamp-ubuntu-s-1vcpu-1gb-tor1-01.ssh > cpe7c9a54544c2a-cm7c9a54544c28.cpe.net.cable.rogers.com.56834: Flags [P.], seq 30756:30968, ack 1, win 501, length 212
16:14:36.238816 IP lamp-ubuntu-s-1vcpu-1gb-tor1-01.ssh > cpe7c9a54544c2a-cm7c9a54544c28.cpe.net.cable.rogers.com.56834: Flags [P.], seq 30968:31180, ack 1, win 501, length 212
16:14:36.238936 IP lamp-ubuntu-s-1vcpu-1gb-tor1-01.ssh > cpe7c9a54544c2a-cm7c9a54544c28.cpe.net.cable.rogers.com.56834: Flags [P.], seq 31180:31392, ack 1, win 501, length 212
16:14:36.239063 IP lamp-ubuntu-s-1vcpu-1gb-tor1-01.ssh > cpe7c9a54544c2a-cm7c9a54544c28.cpe.net.cable.rogers.com.56834: Flags [P.], seq 31392:31604, ack 1, win 501, length 212
16:14:36.239182 IP lamp-ubuntu-s-1vcpu-1gb-tor1-01.ssh > cpe7c9a54544c2a-cm7c9a54544c28.cpe.net.cable.rogers.com.56834: Flags [P.], seq 31604:31816, ack 1, win 501, length 212
16:14:36.239301 IP lamp-ubuntu-s-1vcpu-1gb-tor1-01.ssh > cpe7c9a54544c2a-cm7c9a54544c28.cpe.net.cable.rogers.com.56834: Flags [P.], seq 31816:32028, ack 1, win 501, length 212
16:14:36.239427 IP lamp-ubuntu-s-1vcpu-1gb-tor1-01.ssh > cpe7c9a54544c2a-cm7c9a54544c28.cpe.net.cable.rogers.com.56834: Flags [P.], seq 32028:32240, ack 1, win 501, length 212
16:14:36.239584 IP lamp-ubuntu-s-1vcpu-1gb-tor1-01.ssh > cpe7c9a54544c2a-cm7c9a54544c28.cpe.net.cable.rogers.com.56834: Flags [P.], seq 32240:32452, ack 1, win 501, length 212
16:14:36.239711 IP lamp-ubuntu-s-1vcpu-1gb-tor1-01.ssh > cpe7c9a54544c2a-cm7c9a54544c28.cpe.net.cable.rogers.com.56834: Flags [P.], seq 32452:32664, ack 1, win 501, length 212
16:14:36.239855 IP lamp-ubuntu-s-1vcpu-1gb-tor1-01.ssh > cpe7c9a54544c2a-cm7c9a54544c28.cpe.net.cable.rogers.com.56834: Flags [P.], seq 32664:32876, ack 1, win 501, length 212
16:14:36.239975 IP lamp-ubuntu-s-1vcpu-1gb-tor1-01.ssh > cpe7c9a54544c2a-cm7c9a54544c28.cpe.net.cable.rogers.com.56834: Flags [P.], seq 32876:33088, ack 1, win 501, length 212
16:14:36.240094 IP lamp-ubuntu-s-1vcpu-1gb-tor1-01.ssh > cpe7c9a54544c2a-cm7c9a54544c28.cpe.net.cable.rogers.com.56834: Flags [P.], seq 33088:33300, ack 1, win 501, length 212
16:14:36.240235 IP lamp-ubuntu-s-1vcpu-1gb-tor1-01.ssh > cpe7c9a54544c2a-cm7c9a54544c28.cpe.net.cable.rogers.com.56834: Flags [P.], seq 33300:33512, ack 1, win 501, length 212
16:14:36.240356 IP lamp-ubuntu-s-1vcpu-1gb-tor1-01.ssh > cpe7c9a54544c2a-cm7c9a54544c28.cpe.net.cable.rogers.com.56834: Flags [P.], seq 33512:33724, ack 1, win 501, length 212
16:14:36.240478 IP lamp-ubuntu-s-1vcpu-1gb-tor1-01.ssh > cpe7c9a54544c2a-cm7c9a54544c28.cpe.net.cable.rogers.com.56834: Flags [P.], seq 33724:33936, ack 1, win 501, length 212
16:14:36.240611 IP lamp-ubuntu-s-1vcpu-1gb-tor1-01.ssh > cpe7c9a54544c2a-cm7c9a54544c28.cpe.net.cable.rogers.com.56834: Flags [P.], seq 33936:34148, ack 1, win 501, length 212
16:14:36.240802 IP lamp-ubuntu-s-1vcpu-1gb-tor1-01.ssh > cpe7c9a54544c2a-cm7c9a54544c28.cpe.net.cable.rogers.com.56834: Flags [P.], seq 34148:34360, ack 1, win 501, length 212
16:14:36.240970 IP lamp-ubuntu-s-1vcpu-1gb-tor1-01.ssh > cpe7c9a54544c2a-cm7c9a54544c28.cpe.net.cable.rogers.com.56834: Flags [P.], seq 34360:34572, ack 1, win 501, length 212
16:14:36.241099 IP lamp-ubuntu-s-1vcpu-1gb-tor1-01.ssh > cpe7c9a54544c2a-cm7c9a54544c28.cpe.net.cable.rogers.com.56834: Flags [P.], seq 34572:34784, ack 1, win 501, length 212
16:14:36.241218 IP lamp-ubuntu-s-1vcpu-1gb-tor1-01.ssh > cpe7c9a54544c2a-cm7c9a54544c28.cpe.net.cable.rogers.com.56834: Flags [P.], seq 34784:34996, ack 1, win 501, length 212
16:14:36.241352 IP lamp-ubuntu-s-1vcpu-1gb-tor1-01.ssh > cpe7c9a54544c2a-cm7c9a54544c28.cpe.net.cable.rogers.com.56834: Flags [P.], seq 34996:35208, ack 1, win 501, length 212
16:14:36.241479 IP lamp-ubuntu-s-1vcpu-1gb-tor1-01.ssh > cpe7c9a54544c2a-cm7c9a54544c28.cpe.net.cable.rogers.com.56834: Flags [P.], seq 35208:35420, ack 1, win 501, length 212
16:14:36.241598 IP lamp-ubuntu-s-1vcpu-1gb-tor1-01.ssh > cpe7c9a54544c2a-cm7c9a54544c28.cpe.net.cable.rogers.com.56834: Flags [P.], seq 35420:35632, ack 1, win 501, length 212
16:14:36.241719 IP lamp-ubuntu-s-1vcpu-1gb-tor1-01.ssh > cpe7c9a54544c2a-cm7c9a54544c28.cpe.net.cable.rogers.com.56834: Flags [P.], seq 35632:35844, ack 1, win 501, length 212
16:14:36.241849 IP lamp-ubuntu-s-1vcpu-1gb-tor1-01.ssh > cpe7c9a54544c2a-cm7c9a54544c28.cpe.net.cable.rogers.com.56834: Flags [P.], seq 35844:36056, ack 1, win 501, length 212
16:14:36.241974 IP lamp-ubuntu-s-1vcpu-1gb-tor1-01.ssh > cpe7c9a54544c2a-cm7c9a54544c28.cpe.net.cable.rogers.com.56834: Flags [P.], seq 36056:36268, ack 1, win 501, length 212
16:14:36.242097 IP lamp-ubuntu-s-1vcpu-1gb-tor1-01.ssh > cpe7c9a54544c2a-cm7c9a54544c28.cpe.net.cable.rogers.com.56834: Flags [P.], seq 36268:36480, ack 1, win 501, length 212
16:14:36.242216 IP lamp-ubuntu-s-1vcpu-1gb-tor1-01.ssh > cpe7c9a54544c2a-cm7c9a54544c28.cpe.net.cable.rogers.com.56834: Flags [P.], seq 36480:36692, ack 1, win 501, length 212
16:14:36.242333 IP lamp-ubuntu-s-1vcpu-1gb-tor1-01.ssh > cpe7c9a54544c2a-cm7c9a54544c28.cpe.net.cable.rogers.com.56834: Flags [P.], seq 36692:36904, ack 1, win 501, length 212
16:14:36.242455 IP lamp-ubuntu-s-1vcpu-1gb-tor1-01.ssh > cpe7c9a54544c2a-cm7c9a54544c28.cpe.net.cable.rogers.com.56834: Flags [P.], seq 36904:37116, ack 1, win 501, length 212
16:14:36.242603 IP lamp-ubuntu-s-1vcpu-1gb-tor1-01.ssh > cpe7c9a54544c2a-cm7c9a54544c28.cpe.net.cable.rogers.com.56834: Flags [P.], seq 37116:37328, ack 1, win 501, length 212
16:14:36.242729 IP lamp-ubuntu-s-1vcpu-1gb-tor1-01.ssh > cpe7c9a54544c2a-cm7c9a54544c28.cpe.net.cable.rogers.com.56834: Flags [P.], seq 37328:37540, ack 1, win 501, length 212
16:14:36.242877 IP lamp-ubuntu-s-1vcpu-1gb-tor1-01.ssh > cpe7c9a54544c2a-cm7c9a54544c28.cpe.net.cable.rogers.com.56834: Flags [P.], seq 37540:37752, ack 1, win 501, length 212
16:14:36.243004 IP lamp-ubuntu-s-1vcpu-1gb-tor1-01.ssh > cpe7c9a54544c2a-cm7c9a54544c28.cpe.net.cable.rogers.com.56834: Flags [P.], seq 37752:37964, ack 1, win 501, length 212
16:14:36.243128 IP lamp-ubuntu-s-1vcpu-1gb-tor1-01.ssh > cpe7c9a54544c2a-cm7c9a54544c28.cpe.net.cable.rogers.com.56834: Flags [P.], seq 37964:38176, ack 1, win 501, length 212
16:14:36.243316 IP lamp-ubuntu-s-1vcpu-1gb-tor1-01.ssh > cpe7c9a54544c2a-cm7c9a54544c28.cpe.net.cable.rogers.com.56834: Flags [P.], seq 38176:38388, ack 1, win 501, length 212
16:14:36.243484 IP lamp-ubuntu-s-1vcpu-1gb-tor1-01.ssh > cpe7c9a54544c2a-cm7c9a54544c28.cpe.net.cable.rogers.com.56834: Flags [P.], seq 38388:38600, ack 1, win 501, length 212
16:14:36.243609 IP lamp-ubuntu-s-1vcpu-1gb-tor1-01.ssh > cpe7c9a54544c2a-cm7c9a54544c28.cpe.net.cable.rogers.com.56834: Flags [P.], seq 38600:38812, ack 1, win 501, length 212
16:14:36.250195 IP cpe7c9a54544c2a-cm7c9a54544c28.cpe.net.cable.rogers.com.56834 > lamp-ubuntu-s-1vcpu-1gb-tor1-01.ssh: Flags [.], ack 26304, win 256, length 0
16:14:36.250271 IP lamp-ubuntu-s-1vcpu-1gb-tor1-01.ssh > cpe7c9a54544c2a-cm7c9a54544c28.cpe.net.cable.rogers.com.56834: Flags [P.], seq 38812:39024, ack 1, win 501, length 212
16:14:36.250497 IP lamp-ubuntu-s-1vcpu-1gb-tor1-01.ssh > cpe7c9a54544c2a-cm7c9a54544c28.cpe.net.cable.rogers.com.56834: Flags [P.], seq 39024:39396, ack 1, win 501, length 372
16:14:36.250701 IP lamp-ubuntu-s-1vcpu-1gb-tor1-01.ssh > cpe7c9a54544c2a-cm7c9a54544c28.cpe.net.cable.rogers.com.56834: Flags [P.], seq 39396:39608, ack 1, win 501, length 212
16:14:36.250844 IP lamp-ubuntu-s-1vcpu-1gb-tor1-01.ssh > cpe7c9a54544c2a-cm7c9a54544c28.cpe.net.cable.rogers.com.56834: Flags [P.], seq 39608:39820, ack 1, win 501, length 212
16:14:36.250975 IP lamp-ubuntu-s-1vcpu-1gb-tor1-01.ssh > cpe7c9a54544c2a-cm7c9a54544c28.cpe.net.cable.rogers.com.56834: Flags [P.], seq 39820:40032, ack 1, win 501, length 212
16:14:36.251096 IP lamp-ubuntu-s-1vcpu-1gb-tor1-01.ssh > cpe7c9a54544c2a-cm7c9a54544c28.cpe.net.cable.rogers.com.56834: Flags [P.], seq 40032:40244, ack 1, win 501, length 212
16:14:36.251220 IP lamp-ubuntu-s-1vcpu-1gb-tor1-01.ssh > cpe7c9a54544c2a-cm7c9a54544c28.cpe.net.cable.rogers.com.56834: Flags [P.], seq 40244:40456, ack 1, win 501, length 212
16:14:36.251345 IP lamp-ubuntu-s-1vcpu-1gb-tor1-01.ssh > cpe7c9a54544c2a-cm7c9a54544c28.cpe.net.cable.rogers.com.56834: Flags [P.], seq 40456:40668, ack 1, win 501, length 212
16:14:36.251488 IP lamp-ubuntu-s-1vcpu-1gb-tor1-01.ssh > cpe7c9a54544c2a-cm7c9a54544c28.cpe.net.cable.rogers.com.56834: Flags [P.], seq 40668:40880, ack 1, win 501, length 212
16:14:36.251612 IP lamp-ubuntu-s-1vcpu-1gb-tor1-01.ssh > cpe7c9a54544c2a-cm7c9a54544c28.cpe.net.cable.rogers.com.56834: Flags [P.], seq 40880:41092, ack 1, win 501, length 212
16:14:36.251733 IP lamp-ubuntu-s-1vcpu-1gb-tor1-01.ssh > cpe7c9a54544c2a-cm7c9a54544c28.cpe.net.cable.rogers.com.56834: Flags [P.], seq 41092:41304, ack 1, win 501, length 212
16:14:36.251852 IP lamp-ubuntu-s-1vcpu-1gb-tor1-01.ssh > cpe7c9a54544c2a-cm7c9a54544c28.cpe.net.cable.rogers.com.56834: Flags [P.], seq 41304:41516, ack 1, win 501, length 212
16:14:36.251974 IP lamp-ubuntu-s-1vcpu-1gb-tor1-01.ssh > cpe7c9a54544c2a-cm7c9a54544c28.cpe.net.cable.rogers.com.56834: Flags [P.], seq 41516:41728, ack 1, win 501, length 212
16:14:36.252103 IP lamp-ubuntu-s-1vcpu-1gb-tor1-01.ssh > cpe7c9a54544c2a-cm7c9a54544c28.cpe.net.cable.rogers.com.56834: Flags [P.], seq 41728:41940, ack 1, win 501, length 212
16:14:36.252381 IP lamp-ubuntu-s-1vcpu-1gb-tor1-01.ssh > cpe7c9a54544c2a-cm7c9a54544c28.cpe.net.cable.rogers.com.56834: Flags [P.], seq 41940:42152, ack 1, win 501, length 212
16:14:36.252524 IP lamp-ubuntu-s-1vcpu-1gb-tor1-01.ssh > cpe7c9a54544c2a-cm7c9a54544c28.cpe.net.cable.rogers.com.56834: Flags [P.], seq 42152:42364, ack 1, win 501, length 212
16:14:36.252660 IP lamp-ubuntu-s-1vcpu-1gb-tor1-01.ssh > cpe7c9a54544c2a-cm7c9a54544c28.cpe.net.cable.rogers.com.56834: Flags [P.], seq 42364:42576, ack 1, win 501, length 212
16:14:36.252798 IP lamp-ubuntu-s-1vcpu-1gb-tor1-01.ssh > cpe7c9a54544c2a-cm7c9a54544c28.cpe.net.cable.rogers.com.56834: Flags [P.], seq 42576:42788, ack 1, win 501, length 212
16:14:36.252930 IP lamp-ubuntu-s-1vcpu-1gb-tor1-01.ssh > cpe7c9a54544c2a-cm7c9a54544c28.cpe.net.cable.rogers.com.56834: Flags [P.], seq 42788:43000, ack 1, win 501, length 212
16:14:36.253055 IP lamp-ubuntu-s-1vcpu-1gb-tor1-01.ssh > cpe7c9a54544c2a-cm7c9a54544c28.cpe.net.cable.rogers.com.56834: Flags [P.], seq 43000:43212, ack 1, win 501, length 212
16:14:36.253178 IP lamp-ubuntu-s-1vcpu-1gb-tor1-01.ssh > cpe7c9a54544c2a-cm7c9a54544c28.cpe.net.cable.rogers.com.56834: Flags [P.], seq 43212:43424, ack 1, win 501, length 212
16:14:36.253329 IP lamp-ubuntu-s-1vcpu-1gb-tor1-01.ssh > cpe7c9a54544c2a-cm7c9a54544c28.cpe.net.cable.rogers.com.56834: Flags [P.], seq 43424:43636, ack 1, win 501, length 212
16:14:36.253447 IP lamp-ubuntu-s-1vcpu-1gb-tor1-01.ssh > cpe7c9a54544c2a-cm7c9a54544c28.cpe.net.cable.rogers.com.56834: Flags [P.], seq 43636:43848, ack 1, win 501, length 212
16:14:36.253566 IP lamp-ubuntu-s-1vcpu-1gb-tor1-01.ssh > cpe7c9a54544c2a-cm7c9a54544c28.cpe.net.cable.rogers.com.56834: Flags [P.], seq 43848:44060, ack 1, win 501, length 212
16:14:36.253702 IP lamp-ubuntu-s-1vcpu-1gb-tor1-01.ssh > cpe7c9a54544c2a-cm7c9a54544c28.cpe.net.cable.rogers.com.56834: Flags [P.], seq 44060:44272, ack 1, win 501, length 212
16:14:36.253827 IP lamp-ubuntu-s-1vcpu-1gb-tor1-01.ssh > cpe7c9a54544c2a-cm7c9a54544c28.cpe.net.cable.rogers.com.56834: Flags [P.], seq 44272:44484, ack 1, win 501, length 212
16:14:36.253967 IP lamp-ubuntu-s-1vcpu-1gb-tor1-01.ssh > cpe7c9a54544c2a-cm7c9a54544c28.cpe.net.cable.rogers.com.56834: Flags [P.], seq 44484:44696, ack 1, win 501, length 212
16:14:36.254086 IP lamp-ubuntu-s-1vcpu-1gb-tor1-01.ssh > cpe7c9a54544c2a-cm7c9a54544c28.cpe.net.cable.rogers.com.56834: Flags [P.], seq 44696:44908, ack 1, win 501, length 212
16:14:36.254216 IP lamp-ubuntu-s-1vcpu-1gb-tor1-01.ssh > cpe7c9a54544c2a-cm7c9a54544c28.cpe.net.cable.rogers.com.56834: Flags [P.], seq 44908:45120, ack 1, win 501, length 212
16:14:36.254366 IP lamp-ubuntu-s-1vcpu-1gb-tor1-01.ssh > cpe7c9a54544c2a-cm7c9a54544c28.cpe.net.cable.rogers.com.56834: Flags [P.], seq 45120:45332, ack 1, win 501, length 212
16:14:36.254489 IP lamp-ubuntu-s-1vcpu-1gb-tor1-01.ssh > cpe7c9a54544c2a-cm7c9a54544c28.cpe.net.cable.rogers.com.56834: Flags [P.], seq 45332:45544, ack 1, win 501, length 212
16:14:36.254646 IP lamp-ubuntu-s-1vcpu-1gb-tor1-01.ssh > cpe7c9a54544c2a-cm7c9a54544c28.cpe.net.cable.rogers.com.56834: Flags [P.], seq 45544:45756, ack 1, win 501, length 212
16:14:36.254784 IP lamp-ubuntu-s-1vcpu-1gb-tor1-01.ssh > cpe7c9a54544c2a-cm7c9a54544c28.cpe.net.cable.rogers.com.56834: Flags [P.], seq 45756:45968, ack 1, win 501, length 212
16:14:36.254909 IP lamp-ubuntu-s-1vcpu-1gb-tor1-01.ssh > cpe7c9a54544c2a-cm7c9a54544c28.cpe.net.cable.rogers.com.56834: Flags [P.], seq 45968:46180, ack 1, win 501, length 212
16:14:36.255038 IP lamp-ubuntu-s-1vcpu-1gb-tor1-01.ssh > cpe7c9a54544c2a-cm7c9a54544c28.cpe.net.cable.rogers.com.56834: Flags [P.], seq 46180:46392, ack 1, win 501, length 212
16:14:36.255157 IP lamp-ubuntu-s-1vcpu-1gb-tor1-01.ssh > cpe7c9a54544c2a-cm7c9a54544c28.cpe.net.cable.rogers.com.56834: Flags [P.], seq 46392:46604, ack 1, win 501, length 212
16:14:36.255323 IP lamp-ubuntu-s-1vcpu-1gb-tor1-01.ssh > cpe7c9a54544c2a-cm7c9a54544c28.cpe.net.cable.rogers.com.56834: Flags [P.], seq 46604:46816, ack 1, win 501, length 212
16:14:36.255506 IP lamp-ubuntu-s-1vcpu-1gb-tor1-01.ssh > cpe7c9a54544c2a-cm7c9a54544c28.cpe.net.cable.rogers.com.56834: Flags [P.], seq 46816:47028, ack 1, win 501, length 212
16:14:36.255632 IP lamp-ubuntu-s-1vcpu-1gb-tor1-01.ssh > cpe7c9a54544c2a-cm7c9a54544c28.cpe.net.cable.rogers.com.56834: Flags [P.], seq 47028:47240, ack 1, win 501, length 212
16:14:36.255754 IP lamp-ubuntu-s-1vcpu-1gb-tor1-01.ssh > cpe7c9a54544c2a-cm7c9a54544c28.cpe.net.cable.rogers.com.56834: Flags [P.], seq 47240:47452, ack 1, win 501, length 212
16:14:36.255883 IP lamp-ubuntu-s-1vcpu-1gb-tor1-01.ssh > cpe7c9a54544c2a-cm7c9a54544c28.cpe.net.cable.rogers.com.56834: Flags [P.], seq 47452:47664, ack 1, win 501, length 212
16:14:36.256008 IP lamp-ubuntu-s-1vcpu-1gb-tor1-01.ssh > cpe7c9a54544c2a-cm7c9a54544c28.cpe.net.cable.rogers.com.56834: Flags [P.], seq 47664:47876, ack 1, win 501, length 212
16:14:36.257311 IP cpe7c9a54544c2a-cm7c9a54544c28.cpe.net.cable.rogers.com.56834 > lamp-ubuntu-s-1vcpu-1gb-tor1-01.ssh: Flags [.], ack 36692, win 256, length 0
16:14:36.257396 IP lamp-ubuntu-s-1vcpu-1gb-tor1-01.ssh > cpe7c9a54544c2a-cm7c9a54544c28.cpe.net.cable.rogers.com.56834: Flags [P.], seq 47876:48088, ack 1, win 501, length 212
16:14:36.257581 IP lamp-ubuntu-s-1vcpu-1gb-tor1-01.ssh > cpe7c9a54544c2a-cm7c9a54544c28.cpe.net.cable.rogers.com.56834: Flags [P.], seq 48088:48460, ack 1, win 501, length 372
16:14:36.257714 IP lamp-ubuntu-s-1vcpu-1gb-tor1-01.ssh > cpe7c9a54544c2a-cm7c9a54544c28.cpe.net.cable.rogers.com.56834: Flags [P.], seq 48460:48672, ack 1, win 501, length 212
16:14:36.257843 IP lamp-ubuntu-s-1vcpu-1gb-tor1-01.ssh > cpe7c9a54544c2a-cm7c9a54544c28.cpe.net.cable.rogers.com.56834: Flags [P.], seq 48672:48884, ack 1, win 501, length 212
16:14:36.257965 IP lamp-ubuntu-s-1vcpu-1gb-tor1-01.ssh > cpe7c9a54544c2a-cm7c9a54544c28.cpe.net.cable.rogers.com.56834: Flags [P.], seq 48884:49096, ack 1, win 501, length 212
16:14:36.258237 IP lamp-ubuntu-s-1vcpu-1gb-tor1-01.ssh > cpe7c9a54544c2a-cm7c9a54544c28.cpe.net.cable.rogers.com.56834: Flags [P.], seq 49096:49308, ack 1, win 501, length 212
16:14:36.258430 IP lamp-ubuntu-s-1vcpu-1gb-tor1-01.ssh > cpe7c9a54544c2a-cm7c9a54544c28.cpe.net.cable.rogers.com.56834: Flags [P.], seq 49308:49520, ack 1, win 501, length 212
16:14:36.258556 IP lamp-ubuntu-s-1vcpu-1gb-tor1-01.ssh > cpe7c9a54544c2a-cm7c9a54544c28.cpe.net.cable.rogers.com.56834: Flags [P.], seq 49520:49732, ack 1, win 501, length 212
16:14:36.258715 IP lamp-ubuntu-s-1vcpu-1gb-tor1-01.ssh > cpe7c9a54544c2a-cm7c9a54544c28.cpe.net.cable.rogers.com.56834: Flags [P.], seq 49732:49944, ack 1, win 501, length 212
16:14:36.258837 IP lamp-ubuntu-s-1vcpu-1gb-tor1-01.ssh > cpe7c9a54544c2a-cm7c9a54544c28.cpe.net.cable.rogers.com.56834: Flags [P.], seq 49944:50156, ack 1, win 501, length 212
16:14:36.258981 IP lamp-ubuntu-s-1vcpu-1gb-tor1-01.ssh > cpe7c9a54544c2a-cm7c9a54544c28.cpe.net.cable.rogers.com.56834: Flags [P.], seq 50156:50368, ack 1, win 501, length 212
16:14:36.259104 IP lamp-ubuntu-s-1vcpu-1gb-tor1-01.ssh > cpe7c9a54544c2a-cm7c9a54544c28.cpe.net.cable.rogers.com.56834: Flags [P.], seq 50368:50580, ack 1, win 501, length 212
16:14:36.259223 IP lamp-ubuntu-s-1vcpu-1gb-tor1-01.ssh > cpe7c9a54544c2a-cm7c9a54544c28.cpe.net.cable.rogers.com.56834: Flags [P.], seq 50580:50792, ack 1, win 501, length 212
